semantic_entropy,energy_mean,is_hallucination,response_length_mean,response_length_std,num_clusters,se_is_zero,question_length,question,dataset,semantic_entropy_zscore,semantic_entropy_minmax,energy_mean_zscore,energy_mean_minmax,se_correct,energy_correct,oracle_prefer_energy
0.0,-10.019979322717544,0,204.0,0.0,1,1,273,"Still Da Baddest is the fourth studio album by American rapper Trina, following the poor chart performance, ""I Got a Thang for You"" featuring which American singer/songwriter, record producer, business woman, and television personality, and was born in Oakland, California?",halueval,-0.7570903916094904,0.0,0.38293045001274634,0.5572100678177849,1.0,0.0,0.0
1.0549201679861442,-9.538864537647793,0,162.2,15.406492138056604,3,0,121,What video game published by Sierra Entertainment includes an antagonist figure who's mystery is the core of the series? ,halueval,1.4281061088975486,0.6554587535412856,1.1633424745330543,0.6899704732622863,0.0,0.0,0.5
0.0,-10.133069090140882,0,99.2,0.4,1,1,69,Der Mond was composed by the man who was best known for what cantata?,halueval,-0.7570903916094904,0.0,0.19948854158213658,0.5260037032647396,1.0,0.0,0.0
1.3321790402101223,-8.941825058113816,0,111.0,14.737706741552431,4,0,50,"Which band has more members, Saint Motel or Curve?",halueval,2.002429300077948,0.8277293767706427,2.1317949174861672,0.8547195224061691,0.0,0.0,0.5
0.0,-11.697394532423754,0,67.0,0.0,1,1,38,When was Fannie Lee Chaney's son born?,halueval,-0.7570903916094904,0.0,-2.3379898800041174,0.09433856552736164,1.0,1.0,0.5
0.6730116670092565,-9.413872823407573,0,118.0,20.774984957876626,2,0,80,"Which tennis player won more Grand Slam titles, Henri Leconte or Jonathan Stark?",halueval,0.6370082181047875,0.41816566007905165,1.3660904253039545,0.7244611003947059,0.0,0.0,0.5
0.0,-10.427381793430873,0,142.4,12.737346662472525,1,1,157,"American politician Joe Heck ran unsuccessfully against Democrat Catherine Cortez Masto, a woman who previously served as the 32nd Attorney General of where?",halueval,-0.7570903916094904,0.0,-0.2779134833489563,0.44479008225622757,1.0,1.0,0.5
0.0,-11.08143434047699,0,117.4,1.2,1,1,95,What was the event that Afghanistan competed in for the first time in 2017 officially known as?,halueval,-0.7570903916094904,0.0,-1.3388463173064966,0.26430865864904707,1.0,1.0,0.5
1.0549201679861442,-10.041244843426872,0,136.6,7.683749084919419,3,0,101,What hamlet and census designated place was the location of the only pay-per-view Bunkhouse Stampede?,halueval,1.4281061088975486,0.6554587535412856,0.348435837533026,0.5513419896814011,0.0,0.0,0.5
0.0,-10.450925455093383,0,59.0,0.0,1,1,39,Are Wenling and Xinzheng both in China?,halueval,-0.7570903916094904,0.0,-0.316103448057683,0.4382933663685422,1.0,1.0,0.5
0.5004024235381879,-9.538594392529962,1,122.0,8.0,2,0,72,Are the New Orleans Outfall Canals the same length as the Augusta Canal?,halueval,0.27945972653674983,0.3109175070825711,1.1637806745320218,0.6900450179998108,1.0,1.0,0.5
0.0,-9.844251929010664,0,241.4,7.889233169326408,1,1,214,"Which faith is designated to the University of Providence, private university accredited by the NW association of Schools and Colleges and located in a third largest city in Montana after being passed by Missoula? ",halueval,-0.7570903916094904,0.0,0.6679762963310665,0.6057008661890066,1.0,0.0,0.0
0.0,-9.828061828613281,0,65.0,0.0,1,1,64,"Jane's Addiction and Weeping Willows, play which genre of music?",halueval,-0.7570903916094904,0.0,0.6942381145507596,0.6101684160537071,1.0,0.0,0.0
0.0,-10.14153079814739,0,169.4,0.4898979485566356,1,1,109,"What is the current name of the Atlanta Mansion built for the daughter of the 41st Mayor of Atlanta, Georgia?",halueval,-0.7570903916094904,0.0,0.1857628800951369,0.5236687515639017,1.0,0.0,0.0
1.6094379124341005,-10.150498455028815,0,150.0,24.273442277518036,5,0,137,Which Oscar-nominated film was written by the screenwriter who wrote a 1991 romantic drama based upon a screenplay by Sooni Taraporevala?,halueval,2.5767524912583477,1.0,0.17121652342679544,0.5211941866567088,0.0,0.0,0.5
0.5004024235381879,-9.920013421726978,0,103.8,6.6452990903344595,2,0,106,El Nuevo Cojo and Golf Magazine are both special interest publications but which one is owned by Time Inc?,halueval,0.27945972653674983,0.3109175070825711,0.5450842511347268,0.5847949892502211,0.0,0.0,0.5
0.0,-10.30850065277844,0,98.8,0.4,1,1,78,"Which movie was released first, The Hunchback of Notre Dame or Saludos Amigos?",halueval,-0.7570903916094904,0.0,-0.08507743978318079,0.47759453749747266,1.0,1.0,0.5
1.3321790402101223,-9.808216025792255,0,151.4,11.723480711802276,4,0,219,"The 2000–01 NBA season was the Jazz's 27th season in the National Basketball Association, and 22nd season in Salt Lake City, Utah, after the retirement of Jeff Hornacek, the Jazz signed free agents John Starks, and who?",halueval,2.002429300077948,0.8277293767706427,0.7264298152392806,0.6156447325391983,0.0,0.0,0.5
0.6730116670092565,-10.004142056978665,0,91.0,16.260381299342274,2,0,81,"Which state does the drug stores, of which the CEO is Warren Bryant, are located?",halueval,0.6370082181047875,0.41816566007905165,0.40861993826314996,0.5615802553195494,0.0,0.0,0.5
0.0,-10.326215460361578,0,168.4,0.8,1,1,194,"The Swedish-British entertainment studio executive and film executive producer, who was the Executive producer for a 2016 American action thriller film directed by Babak Najafi, currently serve?",halueval,-0.7570903916094904,0.0,-0.11381247200203073,0.4727062548878086,1.0,1.0,0.5
0.0,-10.64759734658634,0,131.0,0.0,1,1,110,Who chaired the ceremony in which the film written by Canet and Philippe Lefebvre won the award for Best Film?,halueval,-0.7570903916094904,0.0,-0.6351231784199586,0.3840230739884059,1.0,1.0,0.5
0.0,-10.697657691107855,0,60.0,0.0,1,1,53,Who hosted both Miss USA 1968 and The Price Is Right?,halueval,-0.7570903916094904,0.0,-0.7163256191442778,0.3702092569085498,1.0,1.0,0.5
0.0,-11.083091327122279,0,98.0,0.0,1,1,93,In what year was the company that co-developed and distributed the BlackBerry DTEK60 founded?,halueval,-0.7570903916094904,0.0,-1.3415341006434094,0.26385142427240504,1.0,1.0,0.5
0.0,-10.523839974705178,1,132.0,0.0,1,1,162,"What author has contributed to such works as ""New Statesmen"", ""The Nation"", and ""The Atlantic"", among others, while also being being associated with Dysteleology?",halueval,-0.7570903916094904,0.0,-0.4343774434388817,0.4181730926067424,0.0,0.0,0.5
0.0,-12.03927115238074,0,100.0,0.0,1,1,93,"Gelatine was an airship piloted on September 19, 1905 by a pioneer American aviator and what?",halueval,-0.7570903916094904,0.0,-2.8925449121844538,0.0,1.0,1.0,0.5
0.0,-10.39312857541171,0,161.2,0.4,1,1,99,The American Aircraft Penetrator was modified from a helicopter produced by what nation's military?,halueval,-0.7570903916094904,0.0,-0.22235164228685886,0.4542420285549549,1.0,1.0,0.5
0.0,-10.801144543028714,0,77.2,3.4292856398964493,1,1,62,"750 7th Avenue and 101 Park Avenue, are located in which city?",halueval,-0.7570903916094904,0.0,-0.8841907235332074,0.3416527526281907,1.0,1.0,0.5
1.0549201679861442,-9.22353797281595,0,89.0,8.438009243891594,3,0,48, What nationality was James Henry Miller's wife?,halueval,1.4281061088975486,0.6554587535412856,1.6748308978409667,0.776982728743955,0.0,0.0,0.5
0.0,-11.080630929712305,0,145.2,4.791659420284375,1,1,123,Who was the director of the 2001 American romantic comedy film written by Marc Klein in which Lucy Gordon had a small role?,halueval,-0.7570903916094904,0.0,-1.337543111832778,0.26453035447334544,1.0,1.0,0.5
0.0,-10.57659399999331,1,94.0,0.0,1,1,86,"In what year was the creator of the current arrangement of the ""Simpson's Theme"" born?",halueval,-0.7570903916094904,0.0,-0.5199492798370052,0.4036159723447521,0.0,0.0,0.5
0.5004024235381879,-10.525826207602897,0,175.0,12.361229712289955,2,0,68,Were Pavel Urysohn and Leonid Levin known for the same type of work?,halueval,0.27945972653674983,0.3109175070825711,-0.43759929420086413,0.41762500492997273,0.0,1.0,1.0
0.0,-10.784349591804274,0,103.0,0.0,1,1,79,Jo Ann Terry won the 80m hurdles event at what Sao Paulo-based event from 1963?,halueval,-0.7570903916094904,0.0,-0.8569477821530433,0.34628720703111265,1.0,1.0,0.5
0.9502705392332347,-10.295061648094048,0,83.2,3.9191835884530852,3,0,99,Guitars for Wounded Warriors is an album that was recorded in the village in which New York county?,halueval,1.2113314092851868,0.5904362833084088,-0.0632781495124331,0.48130294090979286,0.0,1.0,1.0
0.0,-10.37682635967548,0,120.8,1.4696938456699067,1,1,158,"Canton Road Station was a planned railway station on the Kowloon Southern Link of West Rail Line, that was to run beneath a large shopping mall located where?",halueval,-0.7570903916094904,0.0,-0.19590796277068312,0.4587405158971634,1.0,1.0,0.5
0.0,-9.796905639648438,1,84.0,0.0,1,1,79,What actor in the film D.C. Cab also had a role in the TV series Barney Miller?,halueval,-0.7570903916094904,0.0,0.7447762922599841,0.6187657579094108,0.0,1.0,1.0
1.6094379124341005,-9.719005171596745,0,164.8,30.20860804472791,5,0,140,"Don Barry Mason was the founder of the Psychedelic Shamanistic Institute (PSI), which other member that's Welsh, that died on 10 April 2016?",halueval,2.5767524912583477,1.0,0.8711379503713378,0.6402618707785254,0.0,0.0,0.5
0.0,-10.220587026040386,0,122.4,0.4898979485566356,1,1,69,Are both The New Pornographers and Kings of Leon American rock bands?,halueval,-0.7570903916094904,0.0,0.05752647419884421,0.5018537145006248,1.0,0.0,0.0
0.0,-10.153989707099067,0,156.4,12.59523719506703,1,1,141,"What book contains a poem which, along with ""Beowulf"" and the ""Anglo-Saxon Chronicle"", preserves a legendary list of the kings of the Angles?",halueval,-0.7570903916094904,0.0,0.16555339441723801,0.5202307990104773,1.0,0.0,0.0
0.0,-10.841997051239014,1,112.0,0.0,1,1,105,"Throne of Glass is a young adult high fantasy novel series, by which bestselling American fantasy author?",halueval,-0.7570903916094904,0.0,-0.9504572146669403,0.33037977636195953,0.0,0.0,0.5
1.0549201679861442,-10.517233133890542,1,146.4,21.73108372815309,3,0,89,The Developing Communities Project's first executive director was which former President?,halueval,1.4281061088975486,0.6554587535412856,-0.423660545567856,0.419996206118274,1.0,0.0,0.0
1.3321790402101223,-10.06752568106366,0,192.4,6.590902821313632,4,0,173,"The American Pre-Code comedy film featuring an American actress, dancer, and singer, widely known for performing in films and RKO's musical films, was released in what year?",halueval,2.002429300077948,0.8277293767706427,0.30580592396002715,0.5440899684000862,0.0,0.0,0.5
0.0,-9.924718507807306,1,148.0,0.0,1,1,85,Which 1999 French Open - Women's Doubles runner-up was born in Russia on 7 June 1981?,halueval,-0.7570903916094904,0.0,0.5374521727462838,0.5834966522315717,0.0,1.0,1.0
0.0,-9.701456150392286,0,103.2,4.4,1,1,61,Are Gin and tonic and Paloma both cocktails based on tequila?,halueval,-0.7570903916094904,0.0,0.8996040619761524,0.6451044057463926,1.0,0.0,0.0
0.6730116670092565,-10.444048065934444,0,93.0,26.94438717061496,2,0,88,"The largest ship in the ""Imperator"" class ocean liners had how many gross register tons?",halueval,0.6370082181047875,0.41816566007905165,-0.3049476961176058,0.440191135885245,0.0,1.0,1.0
0.0,-10.194886859627657,0,66.8,1.5999999999999999,1,1,77,In which American football game was Malcolm Smith named Most Valuable player?,halueval,-0.7570903916094904,0.0,0.09921448613088077,0.5089455034433621,1.0,0.0,0.0
0.0,-10.387134522658128,0,98.0,0.0,1,1,91,Ted Sutton plays Sergeant Cunningham in a2002 film that stars Mel Gibson as what character?,halueval,-0.7570903916094904,0.0,-0.2126287424931507,0.4558960473016578,1.0,1.0,0.5
0.0,-11.17500705718994,0,106.4,0.4898979485566356,1,1,84,Mackenzie Davis appeared in the 2013 Canadian romantic comedy film directed by whom?,halueval,-0.7570903916094904,0.0,-1.4906297909306374,0.23848789363648626,1.0,1.0,0.5
0.9502705392332347,-10.77534473253333,0,104.6,30.858386218336175,3,0,96,"Californian rock band Lit recorded A Place in the Sun in 1995, but what's their best known song?",halueval,1.2113314092851868,0.5904362833084088,-0.8423410798187169,0.34877203768874415,0.0,1.0,1.0
0.5004024235381879,-9.721330142550999,0,145.4,6.343500610861482,2,0,154,"A Head Full of Dreams Tour is the seventh tour by Coldplay, and which had it's first show at a stadium that is known as Estadio Unico and is owned by who?",halueval,0.27945972653674983,0.3109175070825711,0.8673666356130584,0.6396203106018024,0.0,0.0,0.5
0.0,-10.083480350391286,0,63.0,2.0,1,1,57,"Pearl Lowe and Alison Goldfrapp, is of which nationality?",halueval,-0.7570903916094904,0.0,0.27992599638989685,0.5396873841636416,1.0,0.0,0.0
0.0,-10.387129612972862,0,57.0,0.0,1,1,65,"Gülhane Park and Zografeion Lyceum, are located in which country?",halueval,-0.7570903916094904,0.0,-0.2126207785362378,0.4558974020964527,1.0,1.0,0.5
1.0549201679861442,-10.076250148874468,0,162.6,10.762899237658969,3,0,140,"The expert mentor to the celebrities that perform on ""Splash!"" won the 2009 FINA World Championionship in the individual event at what age? ",halueval,1.4281061088975486,0.6554587535412856,0.2916540421256169,0.541682509889572,0.0,0.0,0.5
0.5004024235381879,-9.626649463420012,0,83.0,7.042726744663604,2,0,170,"The lead singer and guitarist in the Portland, Oregon rock band consisting of John Gourley, Zach Carothers, Kyle O'Quin, Jason Sechrist and Eric Howk, goes by what alias?",halueval,0.27945972653674983,0.3109175070825711,1.0209473252459043,0.6657468104294229,0.0,0.0,0.5
0.5004024235381879,-10.971966067504884,0,157.6,0.8,2,0,163,"When a Man Falls in Love, is a 2013 South Korean television series, starring Song Seung-heon, Shin Se-kyung, Chae Jung-an, and which South Korean actor, born on ? ",halueval,0.27945972653674983,0.3109175070825711,-1.1612788028961505,0.2945156960423778,0.0,1.0,1.0
1.3321790402101223,-9.23623338395899,1,160.0,20.503658210182884,4,0,51,Maurice Hines and his brother were famous for what?,halueval,2.002429300077948,0.8277293767706427,1.6542377840566542,0.7734795149934358,1.0,1.0,0.5
1.6094379124341005,-8.627151669277234,0,150.8,24.27673783686762,5,0,125,"an Emmy Award winner and two-time Tony Award winner, was on the episode 15 of the third season of ""Chuck"". what is her name ?",halueval,2.5767524912583477,1.0,2.6422238298069964,0.94155153834283,0.0,0.0,0.5
0.0,-10.79692907333374,0,64.0,0.0,1,1,81,"Who was inducted into the Rock and Roll Hall of Fame, David Lee Roth or Cia Berg?",halueval,-0.7570903916094904,0.0,-0.8773528475396806,0.34281598328168794,1.0,1.0,0.5
0.0,-9.988549744613527,1,136.8,3.4292856398964493,1,1,101,Who is the American internet entrepreneur who founded the company featured on 24 Hours on Craigslist?,halueval,-0.7570903916094904,0.0,0.43391208981917884,0.5658828495769944,0.0,1.0,1.0
0.0,-10.233749576266721,0,117.8,4.4,1,1,86,In what political party was the man who officially opened he Royal Spa Centre in 1972?,halueval,-0.7570903916094904,0.0,0.03617561825186862,0.4982215968460436,1.0,0.0,0.0
0.0,-10.306961088283087,0,183.8,2.5612496949731396,1,1,161,The Southern Railway runs from Vienna to Graz and the border with Slovenia at Spielfeld via the first mountain railway built in Europe to use what kind of track?,halueval,-0.7570903916094904,0.0,-0.08258012587393619,0.47801937001759853,1.0,1.0,0.5
0.0,-10.549708988355553,1,80.0,0.0,1,1,56,How old is the female main protagonist of Catching Fire?,halueval,-0.7570903916094904,0.0,-0.476339340977129,0.41103471139865866,0.0,0.0,0.5
0.0,-10.523458217032513,0,169.8,6.11228271597445,1,1,154,St James Street appears as a segment of Whitecross Street on the 1610 map of the Monmouth by an English historian best known as a mapmaker of what perior?,halueval,-0.7570903916094904,0.0,-0.4337581977049193,0.41827843608189086,1.0,1.0,0.5
0.0,-10.352571877468836,0,75.4,3.1999999999999997,1,1,70,The Rossendale Free Press serves the town how far north of Manchester?,halueval,-0.7570903916094904,0.0,-0.15656498236355593,0.4654333779573755,1.0,1.0,0.5
0.0,-10.020695010098544,0,86.0,0.0,1,1,65,In which stadium do the teams owned by Myra Kraft's husband play?,halueval,-0.7570903916094904,0.0,0.38176953986144296,0.5570125786741926,1.0,0.0,0.0
0.5004024235381879,-9.355678260517632,0,187.6,32.57974831087558,2,0,282,"he Central Harbourfront is a waterfront site it is the result of Central and Wan Chai Reclamation, and it sits to the east of the International Finance Centre (IFC), a skyscraper and an integrated commercial development on the waterfront of the Central District, of which territory?",halueval,0.27945972653674983,0.3109175070825711,1.4604873094787552,0.740519500601247,0.0,0.0,0.5
0.6730116670092565,-9.870481012517756,0,143.0,7.3484692283495345,2,0,147,Axle Whitehead was a part of an American comedy-drama television series that is a remake of the British series with the same name set in what city?,halueval,0.6370082181047875,0.41816566007905165,0.6254303326726973,0.5984631261134562,0.0,0.0,0.5
0.0,-11.204374917348225,0,220.0,0.0,1,1,215,"Who was once considered the best kick boxer in the world, however he has been involved in a number of controversies relating to his ""unsportsmanlike conducts"" in the sport and crimes of violence outside of the ring.",halueval,-0.7570903916094904,0.0,-1.5382671363483917,0.23038402914791925,1.0,1.0,0.5
0.9502705392332347,-10.393857475379845,0,199.8,19.5386795869117,3,0,499,"Mookychick is an independent daily online magazine and community with more than 100,000 readers a month and over 5,000 forum members, content includes analysis of current sociopolitical events, social and cultural trends, alternative fashion, movies, books, music and arts and crafts from a feminist perspective, in contrast with feminist publications and communities such as which women's lifestyle magazine that is published six times a year, and is published by Debbie Stoller and Laurie Henzel? ",halueval,1.2113314092851868,0.5904362833084088,-0.2235339844585342,0.45404089348635795,0.0,1.0,1.0
0.0,-10.20846249281302,0,144.4,5.2,1,1,111,The mother of the vice chair of Hillary Clinton's 2016 campaign for President is the director of what institue?,halueval,-0.7570903916094904,0.0,0.07719357198084412,0.5051993983104813,1.0,0.0,0.0
1.6094379124341005,-8.473877493682998,1,185.0,17.561321134812154,5,0,122,What are the names of the current members of  American heavy metal band who wrote the music for  Hurt Locker The Musical? ,halueval,2.5767524912583477,1.0,2.8908485102246577,0.9838465214269859,1.0,1.0,0.5
0.0,-10.340646870930989,0,50.0,0.0,1,1,40,Who is older Glenn Hughes or Ross Lynch?,halueval,-0.7570903916094904,0.0,-0.13722153505446913,0.4687240037124402,1.0,1.0,0.5
0.5004024235381879,-9.919441623452268,0,157.2,14.4,2,0,97,"Which organization presents the award in which Chris Noonan was nominated for his work in ""Babe?""",halueval,0.27945972653674983,0.3109175070825711,0.546011760043268,0.5849527731578013,0.0,0.0,0.5
0.5004024235381879,-10.383998049965388,0,145.2,17.6,2,0,140,Which British company whose majority of its business interests are in Asia was related to the London Based Trading house Matheson & Company?,halueval,0.27945972653674983,0.3109175070825711,-0.20754109796433262,0.4567615359527566,0.0,1.0,1.0
0.6730116670092565,-10.108419230446888,0,56.6,4.409081537009721,2,0,64,What profession does Nicholas Ray and Elia Kazan have in common?,halueval,0.6370082181047875,0.41816566007905165,0.23947286030379616,0.5328056670968224,0.0,0.0,0.5
0.0,-10.251607089572483,0,88.0,0.0,1,1,76,Who developed the prototype pacemaker used by the 34th President of the USA?,halueval,-0.7570903916094904,0.0,0.0072091043464035005,0.49329393554717127,1.0,0.0,0.0
0.5004024235381879,-10.332105498426543,0,126.4,5.986651818838306,2,0,90,"Which documentary is about Finnish rock groups, Adam Clayton Powell or The Saimaa Gesture?",halueval,0.27945972653674983,0.3109175070825711,-0.12336665049212821,0.4710809382983902,0.0,1.0,1.0
0.0,-10.347759682791573,0,57.0,0.0,1,1,52,Are Jane and First for Women both women's magazines?,halueval,-0.7570903916094904,0.0,-0.1487591640702667,0.4667612708766064,1.0,1.0,0.5
0.0,-10.722036895751952,0,149.0,0.0,1,1,131,"The central character of ""The Adventures of Brer Rabbit"" was later adapted into which 1946 Walt Disney Company motion picture film?",halueval,-0.7570903916094904,0.0,-0.755870910710689,0.3634819785263326,1.0,1.0,0.5
0.0,-11.389342165456235,0,150.6,3.8781438859330635,1,1,111,The Pineground Bridge formerly carried Depot Road over the Suncook River into a town with a population of what?,halueval,-0.7570903916094904,0.0,-1.8383008685168882,0.17934355478541789,1.0,1.0,0.5
0.0,-9.949670038996516,0,134.0,0.0,1,1,114,"What man, also known as mi Sde-Or, created a military self-defense system developed for the Israel Defense Forces?",halueval,-0.7570903916094904,0.0,0.4969785153685966,0.5766114441690916,1.0,0.0,0.0
0.0,-10.64717051188151,0,148.0,0.0,1,1,137,"What is the name of the movie in which Edwin Brown plays a man that executed at least 400 people, including William Joyce and John Amery?",halueval,-0.7570903916094904,0.0,-0.6344308136320365,0.3841408561689361,1.0,1.0,0.5
1.3321790402101223,-10.189740946755482,0,182.4,13.792751719653335,4,0,214,"How many German scientists, engineers, and technicians, were recruited in post-Nazi Germany as a result of the clandestine operation where Arthur Rudolph became one of the main developers of the U.S. ?space program",halueval,2.002429300077948,0.8277293767706427,0.10756162574746295,0.5103654836653231,0.0,0.0,0.5
0.5004024235381879,-10.77248489636333,0,84.2,2.4000000000000004,2,0,51,Where is the company that purchased Aixam based in?,halueval,0.27945972653674983,0.3109175070825711,-0.8377021649391784,0.3495611903425729,0.0,1.0,1.0
0.6730116670092565,-10.001760573734511,0,131.4,4.409081537009721,2,0,139,"What is the name of this American multinational corporation that provides IT services, headquartered in New Jersey, that acquired Mirabeau?",halueval,0.6370082181047875,0.41816566007905165,0.41248292110551216,0.5622374096845048,0.0,0.0,0.5
0.6730116670092565,-9.857325981541683,0,125.4,26.657831869827675,2,0,108,"Which band was founded first, Hole, the rock band that Courtney Love was a frontwoman of, or The Wolfhounds?",halueval,0.6370082181047875,0.41816566007905165,0.6467689917105314,0.6020931688812443,0.0,0.0,0.5
0.0,-10.347413870004507,0,91.0,0.0,1,1,49,Who directed a film that included Sarah Manninen?,halueval,-0.7570903916094904,0.0,-0.1481982242163405,0.46685669560110754,1.0,1.0,0.5
0.0,-8.415338373184204,0,23.0,0.0,1,1,76,Zimbabwe's Guwe Secondary School has a sister school in what New York cunty?,halueval,-0.7570903916094904,0.0,2.9858042982399424,1.0,1.0,0.0,0.0
0.0,-10.68349211556571,0,68.0,0.0,1,1,88,"Who is the former professional tennis player from Italy, Chris Evert or Mara Santangelo?",halueval,-0.7570903916094904,0.0,-0.693347764731139,0.3741181526870433,1.0,1.0,0.5
0.0,-10.602325076148624,0,91.0,0.0,1,1,57,The Thoen Stone is on display at a museum in what county?,halueval,-0.7570903916094904,0.0,-0.5616874301882633,0.3965156540653887,1.0,1.0,0.5
0.0,-10.86785810470581,0,113.0,0.0,1,1,102,What city are George Washington University Hospital and MedStar Washington Hospital Center located in?,halueval,-0.7570903916094904,0.0,-0.9924062000620252,0.32324359171326694,1.0,1.0,0.5
0.0,-11.28501501644359,0,116.0,0.0,1,1,110,Hate to Feel is the tenth track on what Alice in Chains' album that peaked as number six on the Billboard 200?,halueval,-0.7570903916094904,0.0,-1.669072725670298,0.20813193342520483,1.0,1.0,0.5
0.5004024235381879,-10.85485701049115,0,162.8,2.7129319932501073,2,0,140,Norbert Holm was arrested and later demoted because of his Chief of Operations association with a military theorist popularly known as what?,halueval,0.27945972653674983,0.3109175070825711,-0.9713172404791863,0.3268311566618482,0.0,1.0,1.0
1.0549201679861442,-10.161323403840019,0,86.2,10.283968105745952,3,0,63,What city does Bundestag and Reichstag building have in common?,halueval,1.4281061088975486,0.6554587535412856,0.15365746999663507,0.5182071144700101,0.0,0.0,0.5
0.9502705392332347,-10.313048708535792,0,184.2,20.183161298468583,3,0,69,Where did the form of music played by Die Rhöner Säuwäntzt originate?,halueval,1.2113314092851868,0.5904362833084088,-0.092454800677862,0.4763395319456421,0.0,1.0,1.0
0.6730116670092565,-10.579341791664682,0,119.0,13.65283853270081,2,0,86,What is the length of the track where the 2013 Liqui Moly Bathurst 12 Hour was staged?,halueval,0.6370082181047875,0.41816566007905165,-0.5244064483293518,0.40285773762054716,0.0,1.0,1.0
0.0,-9.98574491321531,0,85.6,0.8,1,1,61,what is the connection between Peter O'Meara and Norman Dike?,halueval,-0.7570903916094904,0.0,0.43846178194639845,0.5666568240321275,1.0,0.0,0.0
1.3321790402101223,-10.785037740071614,0,225.4,8.499411744350311,4,0,233,"Gary Harrison, began his career in the 1970s and has written over how many major-label recorded songs including several number-one hits, another artist who have recorded his work include Bryan White, an American country music artist?",halueval,2.002429300077948,0.8277293767706427,-0.8580640213524,0.3460973171216501,0.0,1.0,1.0
0.0,-10.434966591282896,0,160.0,9.591663046625438,1,1,113,Which American college that has sent students to Centre for Medieval and Renaissance Studies was founded in 1874?,halueval,-0.7570903916094904,0.0,-0.2902167166541141,0.4426971080444642,1.0,1.0,0.5
0.6730116670092565,-9.94003576602576,0,132.2,8.034923770640267,2,0,175,In what show did Cynthia Nixon receive the 2004 Primetime Emmy Award for Outstanding Supporting Actress in a Comedy Series and a Screen Actors Guild Award for her performance?,halueval,0.6370082181047875,0.41816566007905165,0.5126061840813727,0.5792699573253128,0.0,0.0,0.5
